{
  "task_id": "task-example-001",
  "project_id": "jarvis-agent-ecosystem",
  "policy_version": "phase-2b-context-prototype-1",
  "request_id": "req-safe",
  "request_hash": "a4d334e2c0700d3d528b9d99292415d6faec8ef7665551fb43781e9bfa6d9171",
  "included_source_count": 1,
  "excluded_source_count": 0,
  "included_bytes": 100,
  "estimated_tokens": 10,
  "token_budget": 8192,
  "reserved_tokens": 2048,
  "redaction_count": 0,
  "injection_findings": [],
  "conflicts": [],
  "duplicate_sources": [],
  "truncated_sources": [],
  "human_review_requirement": false,
  "final_assembly_status": "success"
}
